,Unnamed: 0,author,title,description,url,urlToImage,Date,content,source.id,Source
65,65,Thomas Germain,AI-Written Hoax Article About Fake Tans and Racism Fools Irish Newspaper,"The next article you read might be written by a robot, and people who published it might not even know. The Irish Times issued an apology Sunday after running a hoax editorial written by an AI chatbot, which called the incident a “deliberate and coordinated d…",https://gizmodo.com/ai-chatgpt-irish-times-fake-article-racism-fake-tans-1850437207,"https://i.kinja-img.com/gawker-media/image/upload/c_fill,f_auto,fl_progressive,g_center,h_675,pg_1,q_80,w_1200/91a201d1289b4d407b9c90dc79dd18b1.jpg",2023-05-15 15:19:00,The next article you read might be written by a robot and people who published it might not even know The Irish Times issued an apology Sunday after running a hoax editorial written by an AI chatbot which called the incident a deliberate and coordinated deception The article titled Irish women s obsession with fake tan is problematic was attributed to a made up immigrant woman complete with an AI generated photo of the imaginary author We don t take this lightly It was a breach of the trust between The Irish Times and its readers and we are genuinely sorry said Ruadh n Mac Cormaic editor of the Irish Times in a statement presumably written by a human person The incident has highlighted a gap in our pre publication procedures We need to make them more robust and we will It has also underlined one of the challenges raised by generative AI for news organisations We like others will learn and adapt Advertisement According to Mac Cormaic the Times had a lengthy back and forth with the person who submitted the hoax article who took notes and suggestions from editors provided personal anecdotes and updated the piece with links to research The article accused white Irish women who get fake tans of cultural appropriation written from the perspective of a fabricated  year old Ecuadorian woman living in north Dublin named Adriana Acosta Cortez The article published on May th ran with a fake photo picturing a woman with blue hair Advertisement Advertisement As if the prank wasn t humiliating enough a Twitter account adopting Acosta Crotez s personality kept the ruse going online At first the Twitter account responded to comments and criticisms from readers It s not clear whether the account belongs to the person behind the scam but the Twitter user clearly had prior knowledge about the incident Shortly after the Times took the article down the Acosta Cortez account switched gears Lambasting the newspaper for printing an article with such divisive tripe in order to generate clicks and traffic for their website The comments center around some strained point about wokeism rather than highlighting the dangers of AI Advertisement The Times took the article down in less than  hours but the Acosta Cortez Twitter account posted an archived link to the story The AI hoax quickly made international news and sparked a frenzy in the Irish media The Guardian spoke to the person running the Twitter account The person who controls Acosta Cortez s Twitter account told the Guardian on Sunday via direct message that the Irish Times s apology sidestepped its decision to publish an incendiary article with an extreme leftwing viewpoint in pursuit of clicks The person said they were Irish a college student and identified as non binary They said they created the Acosta Cortez persona by repurposing the Twitter account which dates from February  by using some Spanish and following Ecuadorian outlets They said they used GPT  to create approximately  of the article and the image generator Dalle E  to create a profile picture of a quintessential woke journalist using the prompts female overweight blue hair business casual clothing smug expression The hoax s goal was to give my friends a laugh and to stir the shit in the debate about identity politics Some people have called me an alt right troll but I don t think that I am I think that identity politics is an extremely unhelpful lens through which to interpret the world Advertisement Irish journalist Cianan Brennan criticized the imposter for their self induced outrage calling out the so far anonymous person for grandstanding and confused intentions Whole thing is just juvenile Show your face if you re so upset the piece was used Brennan tweeted The opinions in the article are controversial but not entirely without precedent largely what you d expect to find on the opinion pages of a legacy publication The fake article s extreme leftwing views include some thought provoking arguments echoed by sincere writers of color in recent years which is also unsurprising given the fact that chatbots are incapable of generating entirely new ideas Advertisement We can t talk about fake tan without acknowledging the historical context of skin colour and the value that has been placed on it For centuries Eurocentric beauty standards have favoured lighter skin tones often at the expense of people with darker complexions the AI written article said By artificially darkening skin fake tanning culture inadvertently perpetuates the fetishisation of high melanin content without acknowledging the struggles faced by those who naturally possess it It culminates by asking Irish women to consider the implications of your choices and to question the societal norms that guide them This is one of the first times an AI penned hoax made international news since tools like ChatGPT hit the world stage but some publications print robot writing on purpose In April a misinformation watchdog called NewsGuard identified almost  websites covertly printing AI written content in seven languages Chinese Czech English French Portuguese Tagalog and Thai That s to say nothing about the countless AI written books you can buy on Amazon assuming you don t realize that you could just generate the yawn inducing literature yourself using ChatGPT or other free tools Advertisement CNET embarrassed itself last January when it was forced to issue major corrections to a series of ChatGPT written articles including problems with basic math CNET quietly published AI articles for months before readers caught on attributing the stories to CNET Money Staff and hiding a disclosure about the AI on the byline s author page Rest assured that any mistakes you find on Gizmodo com were made by real fleshy human beings,,Gizmodo.com
66,66,Insider Intelligence,"ChatGPT and Generative AI in Insurance: Reality, Hype, What's Next, and How to Prepare",ChatGPT is the most talked-about technology of 2023 and has piqued the interest of insurance industry leaders.,https://www.businessinsider.com/chatgpt-ai-insurance-reality-whats-next-how-to-prepare-hype-2023-may,https://i.insider.com/6440364f3f6f690018de91ee?width=1200&format=jpeg,2023-05-24 18:00:08,ChatGPT a conversational AI model built by OpenAI is the most talked about technology of  And it has piqued the interest of insurance industry leaders But where exactly will ChatGPT and generative AI broadly have the greatest impact And what are its most and least promising use cases Insider Intelligence Generative AI is set to revolutionize various types of insurance Based on the impact of the technology in the US property and casualty insurance will be the most transformed and health insurance will be the second most impacted However life insurance is expected to be least impacted by generative AI especially in the short term Over the course of the next three years there will be many promising use cases for generative AI The most valuable and viable are personalized marketing campaigns employee facing chatbots claims prevention claims automation product development fraud detection and customer facing chatbots Although there are many positive use cases generative AI is not currently suitable for underwriting and compliance While generative AI s rise was sudden it will take time for insurers to fully embrace its power and potential In the full report we delve into the future of generative AI and provide actionable steps for insurance providers to prepare for its rise Click here to purchase this report and use code CHATGPT for ,business-insider,Business Insider
67,67,Beatrice Nolan,"Sci-fi author says he wrote 97 books in 9 months using AI tools, including ChatGPT and Midjourney","In an article for Newsweek, Tim Boucher said he used Midjourney, ChatGPT, and Anthropic's Claude to create the books.",https://www.businessinsider.com/chatgpt-author-time-boucher-midjourney-ai-novels-books-2023-5,https://i.insider.com/646b38f163c86a0018cd1401?width=1200&format=jpeg,2023-05-22 10:34:44,Sci fi author Tim Boucher says he s created  books in nine months with the help of AI In a Newsweek article Boucher said he used Midjourney ChatGPT and Anthropic s Claude The books contain between   to   words and feature  to  AI generated images Morning Brew Insider recommends waking up with a daily newsletter Loading Something is loading Thanks for signing up Access your favorite topics in a personalized feed while you re on the go download the app Email address By clicking Sign Up you also agree to marketing emails from both Insider and Morning Brew and you accept Insider s Terms and Privacy Policy Click here for Morning Brew s privacy policy Sci fi author Tim Boucher says he s created  books in nine months with the help of AI In an article for Newsweek Boucher said he d used AI image generator Midjourney to illustrate the books and ChatGPT and Anthropic s Claude for brainstorming and text generation Boucher told Insider he plans to get to at least   books if not beyond He said My theory is that in the not too distant future there will be tools which will enable me to piece all the disparate parts together into new and compelling combinations Boucher s set of novels are each between   to   words and feature  to  AI generated images He said the books generally take around six to eight hours to create with AI tools and then publish but some can be done in as little as three hours The author is selling the books online for between   and   He wrote in Newsweek AI has proven to be a remarkable catalyst for my creative work It has enabled me to increase my output while maintaining consistent quality and has allowed me to delve into intricate world building with an efficiency I could never have achieved otherwise AI generated novels have been flooding the market in recent months In February ChatGPT was credited as the author or coauthor on more than  titles in Amazon s bookstore Some of the most popular genres were AI guides and children s books Ammaar Reshi a product design manager at a financial tech company based in San Francisco previously told Insider he wrote and illustrated a children s book in  hours using ChatGPT and Midjourney Reshi s book Alice and Sparkle went viral on Twitter after it was met with intense backlash from creatives Some were upset about how AI image generators use their work while others took issue with the quality of the writing Boucher did not immediately respond to Insider s request for comment made outside normal working hours,business-insider,Business Insider
68,68,Hasan Chowdhury,"CEOs see ChatGPT as an 'Ozempic' miracle drug that can cut costs and boost efficiency. Right now, they're wrong.",ChatGPT and the weight-loss drug Ozempic have been seen as quick-fixes. Both come with side effects.,https://www.businessinsider.com/chatgpt-and-ozempic-are-not-magic-bullets-2023-5,https://i.insider.com/609aed40342837001822cd5e?width=1200&format=jpeg,2023-05-30 07:02:08,Ozempic and ChatGPT have blown up in the year of the cure all CEOs are already cutting or pausing jobs thinking AI can replace workers But both come with unforeseen side effects Morning Brew Insider recommends waking up with a daily newsletter Loading Something is loading Thanks for signing up Access your favorite topics in a personalized feed while you re on the go download the app Email address By clicking Sign Up you also agree to marketing emails from both Insider and Morning Brew and you accept Insider s Terms and Privacy Policy Click here for Morning Brew s privacy policy What does a controversial weight loss drug have in common with artificial intelligence Both have boomed in  the year of the apparent quick fix Elon Musk Hollywood celebrities and influencers have rushed in droves for an injection of Ozempic usually used to treat diabetes to curb cravings and help combat weight gain But Ozempic and other so called miracle weight loss drugs can come with debilitating side effects There may be lessons for the business world here when it comes to generative AI tools like ChatGPT which seemingly promise to make humans faster and more productive but also threaten future chaos As Justine Moore investment partner at Silicon Valley VC firm az tweeted this month By  America is going to run on Ozempic and ChatGPT If something seems too good to be true it probably is ChatGPT and competing tools like Google Bard have unquestionably forced people to sit up Seemingly out of nowhere these chatbots can write better than a trainee copywriter or journalist reason like an economist or mathematician pass advanced medical exams recommend books build sites and apps and complete many other tasks Yes they hallucinate but there is no technology that has felt quite so human like in the expansiveness of its capabilities It isn t surprising then that JPMorgan is exploring ChatGPT like tools to aid investing CEOs running businesses that have nothing to do with AI are talking about ChatGPT during their quarterly earnings calls Workers are finding ways of using it to develop side hustles or in their day jobs to make more money ChatGPT creator Sam Altman made the uncanny claim that AI could surpass humanity in most domains within the next  years This kind of superintelligence could carry out as much productive activity as any of today s largest corporations as he put it CEOs are listening UK telecoms giant BT which announced   job cuts last week reckons   of the axed roles could be replaced by AI by  IBM CEO Arvind Krishna said the firm would pause on hiring for roles that might in future be done by AI But like Ozempic AI comes with side effects Fundamentally these new systems are going to be destabilizing Sam Altman CEO of ChatGPT maker OpenAI and AI proponent in chief told lawmakers during a recent Congress appearance If even the man who stands to profit hugely from the widespread adoption of tools like ChatGPT thinks it ll be destabilizing the average CEO should take pause Destabilizing scenarios might include Employees feeding sensitive or proprietary information into a black box AI tool owned by a third party Copyright or other issues stemming from companies not vetting the AI tools they use and the data they re trained on CEOs and other company execs being unable to query decisions made by a black box AI These problems are already here Samsung banned its employees from using generative AI tools after finding some of its engineers accidentally leaked internal source code by uploading it to ChatGPT in April Citigroup Goldman Sachs and JPMorgan heavily restricted employee use of ChatGPT with reports suggesting JPMorgan s decision came about from concerns around sensitive financial data being shared with AI tools Writing for Insider in March copyright law expert John Eden noted whenever an AI platform creates products that successfully compete with copyrighted works leading to diminished sales of those protected works lawsuits will ensue because copyright law abhors free riding For now it s still a wild west There are few guardrails until legislators get to grips with the risks of AI and impose regulation Many experts claim that AI should augment human workers not replace them Chess Grandmaster Garry Kasparov and Professor David De Cremer of the National University of Singapore previously made a case for this suggesting that replacing AI with human workers only works under the assumption that AI and humans have the same qualities and abilities That doesn t mean CEOs and companies should totally avoid AI but it may mean wielding the job cutting axe with a little less enthusiasm just in case ChatGPT turns out to a bomb and a not a miracle drug,business-insider,Business Insider
69,69,Insider Intelligence,"ChatGPT and Generative AI in Insurance: Reality, Hype, What's Next, and How to Prepare",ChatGPT is the most talked-about technology of 2023 and has piqued the interest of insurance industry leaders.,https://www.businessinsider.com/chatgpt-ai-insurance-whats-next-how-to-prepare-reality-hype-2023-may,https://i.insider.com/6440364f3f6f690018de91ee?width=1200&format=jpeg,2023-05-30 18:00:10,ChatGPT a conversational AI model built by OpenAI is the most talked about technology of  And it has piqued the interest of insurance industry leaders But where exactly will ChatGPT and generative AI broadly have the greatest impact And what are its most and least promising use cases Insider Intelligence Generative AI is set to revolutionize various types of insurance Based on the impact of the technology in the US property and casualty insurance will be the most transformed and health insurance will be the second most impacted However life insurance is expected to be least impacted by generative AI especially in the short term Over the course of the next three years there will be many promising use cases for generative AI The most valuable and viable are personalized marketing campaigns employee facing chatbots claims prevention claims automation product development fraud detection and customer facing chatbots Although there are many positive use cases generative AI is not currently suitable for underwriting and compliance While generative AI s rise was sudden it will take time for insurers to fully embrace its power and potential In the full report we delve into the future of generative AI and provide actionable steps for insurance providers to prepare for its rise Click here to purchase this report and use code CHATGPT for ,business-insider,Business Insider
70,70,Diamond Naga Siu,"10 Things in Tech: Renting properties to sublet them, the world’s largest polymer 3D printer, and a bare-bones Tesla Cybertruck interior","In today's edition: A fake personal assistant named Matt, signs that ChatGPT is a black swan event, and more headlines.",https://www.businessinsider.com/amazon-used-car-rent-tesla-airbnb-ai-robinhood-2023-5,https://i.insider.com/646e35406f9a480018736611?width=1200&format=jpeg,2023-05-29 10:30:08,Happy Memorial Day mates I m Diamond Naga Siu and I m excited that the French Open main draw is in full swing today I d love to watch it in person someday But flying to France is super expensive especially from San Diego So maybe I ll try this flight hack called skiplagging that airlines hate My colleague Taylor Rains breaks down how this hack legitimately finds you a cheaper flight But it runs the risk of you getting banned from the airline Maybe it s worth it to see my favorite tennis players compete on clay Before I try skiplagging let s dive into today s tech If this was forwarded to you sign up here Download Insider s app here Left to right Teresha Aird Jasmine Cheng Ihor Stefurak and Randy Baruh Teresha Aird Jasmine Cheng Ihor Stefurak Randy Baruh  ChatGPT helped these people earn more money and become better at their jobs Many people are using ChatGPT to level up their work Insider profiled four of them about how it has made their jobs easier a recruiter broker entrepreneur and chief marketing officer They each use the technology for different aspects of their roles One of them likened the technology to having a   assistant Another uses ChatGPT as their chief technology officer They each took us behind the scenes of how ChatGPT helps with their specific tasks But the common thread among their experiences is how much time ChatGPT saves them My colleague Jack Sommers gathered their profiles and highlighted how these workers turbocharged their jobs with technology Get their full stories here In other news Jamira Burley Source Jamira Burley  I have a fake personal assistant Jamira Burley works in tech and has a personal assistant named Matt He answers emails He negotiates rates He schedules meetings But he s not real Here s why she created him a decade ago  Amazon gave up on its climate pledge The e commerce giant previously promised to make half its shipments net zero carbon by  It recently reversed course and even deleted the blog post announcing its initiative But Insider dug it up anyways Read it here  ChatGPT is a black swan event These rare events occur when something unforeseen happens with far reaching impacts but in hindsight it looked inevitable Many signs like how ChatGPT blew up Big Tech point to it qualifying Check them all out here  This couple rents properties to sublet them on platforms like Airbnb Nathan and Taniera Turner turned to this side hustle after both got laid off at the start of the pandemic Now they ve scaled up to  different properties Here s how they did it  Remote first Robinhood is going back in person CEO Vladimir Tenev ordered employees back to the office four days per week starting in September He wrote there is value in us being together in the email Read his full office order here  The bare bones Tesla Cybertruck interior We might just have gotten a first look inside the Tesla Cybertruck Photos allegedly from a shareholder day began circulating online And the interior is shockingly minimalistic Drive over to check it out here    doesn t go far for a car Around five years ago  of used cars were under   Now only around  of used cars are under that pricepoint Hop in to see the full used car landscape here Odds and ends University of Maine Advanced Structures and Composites Center  The world s largest polymer D printer It s like a massive glue gun with hundreds of settings The gigantic device  feet long and  feet tall helped print a  square foot tiny home in Maine Tour the structure here btw Then get a full  look at the printer here  I run a homeschool agency for clients like Kylie Jenner and Khlo Kardashian It s a one stop shop for families whose lifestyles didn t align with traditional schooling Tiffany Sorya shares what it s like catering education for the ultra rich Get her schooling story here What we re watching today Curated by Diamond Naga Siu in San Diego Feedback or tips Email dsiu insider com or tweet diamondnagasiu Edited by Alistair Barr tweet alistairmbarr in San Francisco and Hallam Bullock tweet hallam bullock in London,business-insider,Business Insider
71,71,George Glover,"The AI craze drove investors to pour a record $8.5 billion into tech funds last week, Bank of America says","The ChatGPT-fueled ""baby bubble"" has become the dominant theme for markets, strategist Michael Hartnett said in a research note.",https://markets.businessinsider.com/news/stocks/tech-stocks-funds-ai-chatgpt-bank-of-america-michael-hartnett-2023-6,https://i.insider.com/6479c8b62a124c0019e17c8d?width=1200&format=jpeg,2023-06-02 12:13:34,Investors poured a record   billion of cash into tech funds last week Bank of America found They re piling into the sector with the Nasdaq Composite on a tear up  year to date The AI baby bubble has become the dominant theme for markets strategist Michael Hartnett said Sign up for our newsletter to get the inside scoop on what traders are talking about delivered daily to your inbox Loading Something is loading Thanks for signing up Access your favorite topics in a personalized feed while you re on the go download the app Email address By clicking Sign up you agree to receive marketing emails from Insider as well as other partner offers and accept our Terms of Service and Privacy Policy Investors are piling more cash into tech stocks than ever before thanks to the artificial intelligence craze according to Bank of America Tech funds brought in a record   billion in the week ending May  the bank found AI is probably fueling inflows into the sector a team led by strategist Michael Hartnett said in a note to clients on Friday The explosion of interest in ChatGPT at the start of the year ignited an AI frenzy for investors with big names like Bill Ackman and Stanley Druckenmiller loading up on related stocks That s driven a tech boom with the Nasdaq Composite index up  in  and blue chip names Nvidia and Meta racking up triple digit returns in the first five months of the year There s a risk the tech rally will fizzle out soon according to Hartnett with technical analyses suggesting the sector may be overbought The strategist has previously said there could be an AI baby bubble that echoes the excessive valuations of internet related stocks in the early s before the dot com crash He said in Friday s note that he s still bearish on equities as an asset class with the Federal Reserve potentially revving up for further interest rate hikes later this year as it presses ahead with its war on inflation Stocks tend to fall when rates rise because investors are able to get higher returns by parking their cash in government bonds and savings accounts Tech companies share prices tend to take a particular hit because their valuations are often reliant on borrowing cash which becomes more expensive when the Fed tightens and price in their future growth which might be slower if the wider economy cools Contrarian minded investors should sell AI stocks and buy shares in Hong Kong listed companies which could benefit from China s efforts to revive its faltering economy Hartnett said Read more Tech stocks are outperforming their rivals by the most since the dot com bubble,business-insider,Business Insider
