,Unnamed: 0,author,title,description,url,urlToImage,Date,content,source.id,Source
20,20,Casey Newton,How Google is making up for lost time,"At Google I/O 2023, the company showed how it’s finally bringing AI to the places that matter: Search, Docs, Slides, and more services we already use.",https://www.theverge.com/2023/5/12/23721037/google-ai-progress-search-docs-starline-video-calls,https://cdn.vox-cdn.com/thumbor/gnBLqI0EzeruySPPaVzHMd-hSaA=/0x0:3601x2401/1200x628/filters:focal(1145x960:1146x961)/cdn.vox-cdn.com/uploads/chorus_asset/file/24649939/DSC00168_edit.jpg,2023-05-12 13:30:00,The arrival of ChatGPT last year sent a rare shiver through Google s spine For years the company had positioned itself as a leader in the development in artificial intelligence Suddenly though a product from the upstart OpenAI rocketed to tens of millions of monthly users and observers began asking whether Google had squandered its lead Within weeks leaders at the company declared a code red a signal that the time to begin shipping AI features was now It was widely reported that CEO Sundar Pichai declared the code red but he later told me that it wasn t the case A handful of products have shipped since most notably Bard the company s ChatGPT analog But on Wednesday at the company s annual developer conference the floodgates opened At Google I O a torrent of new AI features were announced touching nearly every part of the company s product lineup Getting users to switch platforms is proving more difficult some imagined it would be For the most part these products will ship in the coming weeks or later this year Until then all we really have to go on is the previews we saw in demonstrations and pre conference press briefings But while I imagine the features will vary in quality and usefulness one thing is becoming clear about the near term AI future technology alone is not enough to totally reset the competitive landscape Incumbents can gain significant ground simply by bringing new features into the products that people are already using and getting users to switch platforms is proving more difficult some imagined it would be Let s take platform switching first In February Microsoft re launched Bing with generative AI search results powered by ChatGPT The company hoped it would be a moment that consumers gave Bing a second look and would perhaps give Microsoft a chance to peel off meaningful market share from its much bigger rival Three months later and on the eve of Google adding generative AI results to its own search engine that project appears to have stalled Citing a report from the research firm YipitData The Information reported Wednesday that Bing s share of searches on desktops had grown just   percent in the past three months Microsoft told the outlet that the growth rate was higher on mobile devices and perhaps it will grow on desktops as well in the coming months But the same story noted that ChatGPT receives more than  million visits per day compared to  million for  year old Bing People who want to use OpenAI s chatbot are largely going straight to the source and Microsoft which is just one of dozens of companies integrating OpenAI s technology in the hopes that it will open up new revenue streams is finding that API access is a commodity rather than a growth engine I m sure Microsoft will eventually find plenty of ways to make money from AI starting with all the infrastructure services it provides OpenAI through its Azure platform But still The lesson here is that with the possibly lone exception of ChatGPT users are mostly not seeking out AI as a destination unto itself Rather they re waiting for it to transform into useful products and services ideally products and services that they re already using The sidekick feature in Google Docs Image Google Last week I wrote about AI s missing interface and the challenges presented by a technology whose interface design begins and ends with a text box One way of thinking about I O this year is that Google began to fill in the missing pieces of that interface with actual product design a commitment to nudging users in all sorts of ways into using AI productively Let s look at a few of those ways Until now Bard has been an island unto itself a sandbox for testing the limits of Google s large language model PaLM Pretty soon though you ll be able to export Bard s output into Gmail Docs and Sheets the places you were probably going to copy and paste it to anyway ChatGPT probably records more copy and paste actions than any other website in the world Google is abstracting that whole process away into a button Ideally though you d never have to visit a dedicated website to use generative AI in the first place For example at the moment lots of people are having ChatGPT write their emails and then porting them over into their email client of choice Google is taking the obvious next step promising that later this year you ll be able to just ask Gmail to write the email for you in the message composer window I predict ChatGPT sees fewer copy and paste actions after that You could also just stick generative AI boxes into existing productivity tools the way Google showed with its sidekick feature In one of the day s best demos Google executive Aparna Pappu showed off the sidekick in Docs As she imagined writing a short story about a missing seashell with her niece the sidekick chimed in with contextual suggestions What happened to the seashell it wanted to know Then the sidekick offered some suggestions maybe it was stolen by a jealous mermaid Maybe it was taken by a time traveler Maybe it was eaten by a squid This is how AI is going to start working its way into our lives If you re a  year old writing a short story this is going to be a lot of fun And it probably doesn t even come across to the average user as AI per se instead it just feels like a new creative tool that takes a popular existing product and makes it more useful There were a lot more demos like that yesterday I was struck by one that generated speaker notes from a set of slides sure to be a godsend for procrastinating workers everywhere and another that created a list of dishes that people were bringing to some potluck based on an attached Google Sheet Viewed one way some this stuff can feel pretty mundane But in the near term this is how AI is going to start working its way into our lives Soon enough we probably won t think of it as AI anymore A recurring and somewhat defensive theme of yesterday s keynote is that Google has already shipped lots of stuff that uses machine learning but for whatever reason doesn t meet our ever shifting definition of what counts as AI Searching for dogs in Google Photos for example There s surely another column to be written here about Google s planned changes to search which will put a module of generative AI results on top of the standard  blue links But I want to wait until I can actually try it for myself to get a better sense of how disruptive it feels For now with search and everything else Google has positioned AI not as an all knowing oracle but as a useful starting point for many tasks Google s AI will write the first draft offer alternate paths to consider or do a cursory scan of a new subject you re interested in This has the benefit of being how people actually use AI in practice today and it s smart of Google to lean into that message rather than something more grandiose Ultimately I still believe the AI opportunity will be much bigger than one company But in a moment when all these large language models are converging to become roughly functionally equivalent no one is going to win the game on technology alone AI is moving from a science problem to a product design and marketing problem and the latter are things that Google has had a lot of experience with A better metaverse The best thing I saw at Google I O was Project Starline an experimental piece of hardware that asks what if the person on your next Zoom call was a hologram The year long discussion we had about the metaverse from  to  often touched on the idea of telepresence technologies that allow people to feel as if they are physically present with someone even when they are only being represented digitally Other than Zoom the best we have been able to do on this front is to strap on ungainly headsets navigate ourselves into pixelated conference rooms and talk to legless cartoon versions of our colleagues and loved ones Project Starline which remains early in its development and would need to get radically cheaper to go mainstream requires only that you sit down in front of the TV like device and turn it on There are no headsets glasses or headphones to fiddle with just a person talking to you in three dimensions and at admirably high resolution Andrew Nartker Starline s general manager demonstrated it for me while sitting in a separate booth When he went to give me a fist bump his hand appeared to come through the TV screen Later he offered me an apple and the effect was just as realistic And all the while Nartker s voice tracked his movements as he changed positions enhancing the illusion that he was right there in front of me In reality he was in a booth a few feet away from the one I was sitting in I m sure that behind the scenes there were hidden technological enhancements that you might not find in the real world a rock solid data pipe linking the devices for example And in my conversation with Googlers yesterday it was clear that the primary obstacle to Starline s development will be making it much less expensive than it is today No one would tell me how expensive it is but if you told me the whole setup cost a million dollars or more it would not seem excessive relative to the quality of the experience The good news is that there are signs Starline is coming down the cost curve Google said this week that it has begun testing the device with partners including Salesforce T Mobile and WeWork as well as at Google itself Given the challenges and all the cost cutting going on at Google and elsewhere few would be surprised if Starline ultimately proves to be vaporware But there s something profound here that Meta s metaverse hasn t come close to achieving a convenient comfortable ergonomic form of video chat that I could easily imagine myself doing for hours I m sure I ll take my share of meetings in virtual reality over the next few years if only because of how much cheaper they are than installing Project Starline at my house,the-verge,The Verge
21,21,namerah.saud-fatmi@futurenet.com (Namerah Saud Fatmi),Here are all the smartwatches that can use ChatGPT,"You can put ChatGPT on any modern smartwatch, as long as it's a compatible model. These are all the smartwatches that can use ChatGPT.",https://www.androidcentral.com/wearables/smartwatches-that-can-use-chatgpt,https://cdn.mos.cms.futurecdn.net/7LsTs3Be7fUcqvybNscbKg-1200-80.jpg,2023-05-15 18:30:34,AI language models have never been more popular thanks to OpenAI s wildly successful ChatGPT Modern technology and clever ports have made it possible for you to use the chatty AI right off of your wrist as long as you have a compatible smartwatch Essentially any smartwatch that runs Wear OS  can use ChatGPT As for Apple s wearables you can access the AI as long as you have the Apple Watch Series  or a newer variant Unsure whether your Wear OS or watchOS wearable can use ChatGPT Just check whether you can find your smartwatch in the list of compatible devices below We ve rounded up all the smartwatches that can use ChatGPT right here for your perusal Apple Image credit Andrew Myrick Android Central Apple Watch Ultra Apple Watch Series  Apple Watch SE  Apple Watch Series  Apple Watch SE Apple Watch Series  Apple Watch Series  Apple Watch Series  ASUS Image credit Android Central ZenWatch  ZenWatch  Fossil Image credit Derrek Lee Android Central Fossil Gen  Gen  Wellness Edition Fossil Gen  E Fossil Gen  Fossil Gen  Google Image credit Nicholas Sutrich Android Central Pixel Watch Huawei Image credit Android Central Huawei Watch  Classic Huawei Watch  Huawei Watch Kate Spade New York Image credit Android Central Scallop  LG Image credit Android Central LG Watch W LG Watch Sport LG Watch Style LG Watch Urbane nd Edition LG Watch Urbane LG G Watch R Louis Vuitton Image credit Louis Vuitton Tambour Horizon  Tambour Horizon  Michael Kors Image credit Michael Kors Michael Kors Gen  Michael Kors Gen E Michael Kors Gen  Michael Kors Access Mobvoi Image credit Chris Wedel Android Central TicWatch Pro  TicWatch E TicWatch Pro  Pro  Ultra TicWatch C TicWatch E TicWatch S TicWatch C TicWatch Pro Pro G TicWatch S TicWatch E Montblanc Image credit Android Central Montblanc Summit  Montblanc Summit Lite Montblanc Summit  Summit  Montblanc Summit Motorola Image credit Android Central Moto  rd generation  Moto  Sport Moto  nd generation  New Balance Image credit Tom s Guide New Balance RunIQ Nixon Image credit TechRadar Nixon Mission OPPO Image credit Apoorva Bhardwaj Android Central OPPO Watch  Watch  Pro OPPO Watch  OPPO Watch Polar Image credit Polar Polar M Samsung Image credit Andrew Myrick Android Central Galaxy Watch   Pro Galaxy Watch   Classic Skagen Image credit Nicholas Sutrich Android Central Skagen Falster Gen  Skagen Falster  Skagen Falster  Suunto Image credit Android Central Suunto  TAG Heuer Image credit Android Central TAG Heuer Connected Calibre E TAG Heuer Connected Modular  TAG Heuer Connected ZTE Image credit Tom s Guide ZTE Quartz Chitchat with the hottest AI model on your wearable Why you can trust Android Central Our expert reviewers spend hours testing and comparing products and services so you can choose the best for you Find out more about how we test Image credit Nicholas Sutrich Android Central While OpenAI hasn t rolled out an official Wear OS app or watchOS app for ChatGPT it s relatively easy to install it on your wearable of choice Both platforms have fantastic ports for the AI that are readily available You need to have a Wear OS smartwatch running Wear OS  or higher to access the ChatGPT app Happily this includes many of the older models from brands that have gone defunct or simply pulled out of the smartwatch market Whether you re still hanging on to your ancient LG Watch Sport or you just upgraded to the swanky Google Pixel Watch you can install ChapGPT on your smartwatch Once you ve made sure that your Wear OS device is powered by Wear OS  or Wear OS  you can proceed to install the ChatGPT app We have an in depth guide that teaches you how to put ChatGPT on a Galaxy Watch Pixel Watch or any other Wear OS device You need to install the WearGPT app from your watch s Play Store first and then follow the rest of the instructions from our guide On the other hand Apple Watch users need to take a different route If you ve got the Apple Watch Series  or later models you can use ChatGPT on your watchOS device Simply head to the Apple App Store and download the Petey app Unfortunately watchOS users need to pay to get ChatGPT on their smartwatches Petey costs   for the base version of the app If you want to access GPT  you ll need to shell out some more dough To learn how to get ChatGPT on your Apple Watch and how to use it read this excellent explainer from iMore The wearable marketplace is constantly growing To keep you well informed we ll update this list periodically to add all the latest compatible smartwatches Updated  May  Added the Mobvoi TicWatch Pro ,,Android Central
22,22,insider@insider.com (Insider Intelligence),ChatGPT and Generative AI: Our Guide to 2023's Most Talked-About Technology,ChatGPT brought generative AI into the limelight when it hit 1 million users in five days. But how valid is the buzz around ChatGPT?,https://www.businessinsider.com/generative-ai-chatgpt-guide-to-most-talked-technology-2023-june,https://i.insider.com/64403fa23f6f690018de9578?width=1200&format=jpeg,2023-06-01 16:30:00,ChatGPT brought generative AI into the limelight when it hit  million users in five days But how valid is the buzz around ChatGPT We unpack what you need to know How does generative AI work Who are the key players Is ChatGPT ready for prime time And most importantly How will the technology change the way we do business Insider Intelligence So what exactly is generative AI and why should you care Generative AI is artificial intelligence that creates content from simple prompts and context This new technology can be used to create everything from essays to D objects and newer models can even combine more than one capability Generative AI comprised less than  of total US venture capital VC funding of   billion in  according to PitchBook and the National Venture Capital Association NVCA But an estimated  startups and several new funds for generative AI indicate a hot market and high hopes for growth What is ChatGPT and how does it fit into the equation ChatGPT is a conversational AI model built by OpenAI GPT stands for generative pretrained transformer Released November   as a proof of concept it gained  million users in five days and blasted into the popular consciousness Despite the excitement many limitations and challenges remain and OpenAI CEO Sam Altman tweeted a warning about ChatGPT it s a mistake to be relying on it for anything important right now Generative AI models simulate how we think by relying on algorithms that learn with each use They start with millions of labeled pictures text or other media and gradually identify patterns that allow them to understand and create content independently Humans often fine tune a model as it evolves Although OpenAI is the best known generative AI company it s not the only one Creative industries have already started to feel the change of workflows due to generative AI Copywriters designers coders photo and video editors and even strategists now have access to generative AI tools that can simplify their day to day tasks However it has the potential to disrupt some businesses and will spark backlash over accuracy fairness and plagiarism Generative AI is triggering a communications revolution that will make it much easier to research create and test content And the changes will likely happen more quickly than in past content revolutions Want to learn more about ChatGPT and Generative AI Click here to purchase the full report and use code CHATGPT for  off,business-insider,Business Insider
23,23,Angela Watercutter,'Elvis' Director Baz Luhrmann Doesn't Think AI Will Conquer Movies,Taking over the rest of the world is another matter.,https://www.wired.com/story/baz-luhrmann-interview-artificial-intelligence-hollywood/,"https://media.wired.com/photos/645d3bed9d819fb102d005f6/191:100/w_1280,c_limit/BazLuhrumann_Monitor_GettyImages-1399258166.jpg",2023-05-12 13:00:00,The Monitor is a weekly column devoted to everything happening in the WIRED world of culture from movies to memes TV to Twitter Baz Luhrmann blends in well here The Australian writer director and producer is known for his flashy hyper realistic style and on this particular New York night he s in a sparse brightly lit former taxi warehouse in Chelsea talking to a robot The bot s name is Ai Da she s a painter powered by artificial intelligence Yes she identifies as female Before Luhrmann took the stage next to her she was doing a watercolor while people gawked and took photos Did you see Elvis Ai Da he asked She paused for an almost awkward period before replying Her favorite Luhrmann film is Romeo Juliet The director was unfazed I am not fearful of AI Luhrmann told me prior to the presentation which he gave as part of the opening of a new art installation called Saw This Made This Then he backpedaled a bit clarifying that he s not fearful of AI taking his job as a director I spoke to Ai Da this morning and said Should we be concerned about AI destroying the world and she said Absolutely Ultimately Luhrmann says AI is a new technology and how it will be used for creative purposes or nefarious ones depends on humans Pretty much every writer director musician and painter is facing the AI question right now Many answers echo Luhrmann s It depends on their interactions with the technology Members of the Writers Guild of America who are currently on strike are concerned that studios may one day soon want AI to write scripts that human writers then fix for a lower fee Frank Ocean fans are reportedly getting scammed into paying for machine generated songs Visual artists claim AI models are unfairly being trained on their work This week author Stephen Marche released a novella he wrote with considerable help from large language model LLM tools ChatGPT Sudowrite and Cohere The outcome of these conflicts over AI use in pop culture will have ramifications for decades to come That s why the arguments are so heated Tech has been evolving and forgive me disrupting things for long enough now that people know the signs Without some shared laws beliefs and ethics to govern the ways AI can be used it could run rampant Without the guidelines currently employed by the US Copyright Office stipulating that copyrightable works must have human authorship without rules about what jobs AI can do chaos reigns Ironically chaos is what Luhrmann notes that humans can handle and AI can t Artists to a person are generally self medicating flaws and chaos within them he says The thing AI just doesn t have at the center of it is random chaos Emotion I note the sign seen on the WGA picket line that said ChatGPT doesn t have childhood trauma The director agrees There s understandable fear he says because when you get this massive change there s going to be things caught in the crossfire That doesn t mean he thinks AI can replace human creativity at least not presently Which brings us back to Elvis Presley There are people who change their appearance their bodies their mannerisms in order to perform as the King of Rock n Roll They re called impersonators In his Elvis movie Luhrmann says Austin Butler did not do an impersonation What he did was Austin Butler s interpretation of the soul of Elvis Presley An AI can impersonate it can t interpret As we re parting I ask him what he d like to do as a filmmaker with AI Turns out he has already incorporated it into his work it was the tech he used to fade Butler s face into Presley s,wired,Wired
24,24,,Japan privacy watchdog warns ChatGPT maker OpenAI on data ... - Reuters,Japan privacy watchdog warns ChatGPT maker OpenAI on data ...  Reuters,https://consent.google.com/ml?continue=https://news.google.com/rss/articles/CBMicGh0dHBzOi8vd3d3LnJldXRlcnMuY29tL3RlY2hub2xvZ3kvamFwYW4tcHJpdmFjeS13YXRjaGRvZy13YXJucy1jaGF0Z3B0LW1ha2VyLW9wZW5haS1kYXRhLWNvbGxlY3Rpb24tMjAyMy0wNi0wMi_SAQA?oc%3D5&gl=FR&hl=en-US&cm=2&pc=n&src=1,,2023-06-02 03:22:00,TOKYO June  Reuters Japan s privacy watchdog said on Friday it has warned OpenAI the Microsoft backed MSFT O startup behind the ChatGPT chatbot not to collect sensitive data without people s permission OpenAI should minimise the sensitive data it collects for machine learning the Personal Information Protection Commission said in a statement adding it may take further action if it has more concerns Regulators around the world are scrambling to draw up rules governing the use of generative artificial intelligence AI which can create text and images the impact of which proponents compare to the arrival of the internet While Japan has been on the backfoot with some recent technology trends it is seen as having greater incentive to keep pace with advances in AI and robotics to maintain productivity as its population shrinks The watchdog noted the need to balance privacy concerns with the potential benefits of generative AI including in accelerating innovation and dealing with problems such as climate change Japan is the third largest source of traffic to OpenAI s website according to analytics firm Similarweb OpenAI CEO Sam Altman in April met Prime Minister Fumio Kishida with an eye to expansion in Japan ahead of the Group of Seven G leaders summit where Kishida led a discussion on regulating AI The EU a global trendsetter on tech regulation set up a taskforce on ChatGPT and is working on what could be the first set of rules to govern AI In the meantime the rapid spread of such chatbots has meant regulators have had to rely on existing rules to bridge the gap Italian regulator Garante had ChatGPT taken offline before the company agreed to install age verification features and let European users block their information from being used to train the system Altman last week said OpenAI had no plans to leave Europe after earlier suggesting the startup might do so if EU regulations were too difficult to comply with Reporting by Kantaro Komiya and Sam Nussey Editing by Jacqueline Wong Christopher Cushing and Sharon Singleton Our Standards The Thomson Reuters Trust Principles,google-news,Google News
